{"$schema":"./challenger-replacement-simulation-contract-v1.schema.json","accounting":{"binary_float_allowed":false,"continuous_high_water":true,"contract_multiplier_required":true,"decimal_arithmetic_only":true,"fee_authority":"CONTRACT_MUST_EQUAL_INSTRUMENT_METADATA","funding_cashflow_formula":"NEGATIVE_SIGNED_Q_TIMES_MULTIPLIER_TIMES_MARK_TIMES_RATE","perpetual_conservative_mark":"MARK","perpetual_short_quantity_sign":"NEGATIVE","spot_conservative_mark":"BID","utc_day_start_boundary":"POST_STOP_FUNDING_MARK_BEFORE_NEW_ACTION"},"authority":{"account_requests":0,"broker_requests":0,"credentials_used":false,"network_requests":0,"orders_submitted_to_venue":0,"production_activation":false,"production_state_writes":0,"real_orders_allowed":false,"replacement_start_authorized":false,"runtime_install_authorized":false},"capital_limit_usdt":"100","configured_leverage":"1","contract_hash":"b21beb877101590aabcc65927539d58eb001c4dc5de89ead0306ac840450f501","contract_id":"challenger_replacement_simulation_contract_c95cee71f23e58cf40bc4739e5063824de1a77fd5c6fcc72794ff42e1f84f791","economic_asset":"ETH","fill_model":"DETERMINISTIC_IMMEDIATE_FULL_MARKET_FIXTURE","funding_source":"EXACT_FIXTURE_RATE_AT_SCHEDULED_BOUNDARY","gross_exposure_limit":"0.5","market_order_slippage_per_side":"0.001","mode":"FIXTURE_ONLY_DETERMINISTIC_BINANCE_SIMULATION","perpetual_taker_fee":"0.0015","plan":{"file_sha256":"6fae2ae0df4b8402ddc1df1b5bca611e11df41eee8d42f591d5d7b5fb24a31c3","plan_hash":"f29474a1700b0c3cf313047e2d6e85182e68104d9584ec9df7b492aa7ab00486","plan_id":"challenger_replacement_plan_v3_e1b6a4187cb4bb4b371ea503f83284056d4f0c6c504feb7827971869a52f666f"},"policy_bindings":{"decision_policy_hash":"1a201f174e45f1f990efd5d4198fa1be3b00de0115fa1ff73d2aef046456ad32","opportunity_policy_hash":"032d5a5a706a50a5e053b1d86247d67005aa9f74178b43f2a81d8937e6c2af4d","product_policy_hash":"61b7e40509146bbae2d7581dc14b45e12b839c7fa18e54073406f5ef707bbe92","risk_policy_hash":"f7d42570ef7772914d6c9753a7402f62aa8b2d7583693521ae5faf643d9a2fab","storage_authority_policy_hash":"dcf89c804d2576c88ffd590a27c1a736a2dc4ed9a79a8879c675f8156b2dc8ee"},"products":{"perpetual_direction":"SHORT_ONLY","perpetual_instrument":"BINANCE:USDT_PERP:ETHUSDT","perpetual_margin_mode":"ISOLATED","perpetual_position_mode":"ONE_WAY","products_mutually_exclusive":true,"spot_direction":"LONG_ONLY_UNMARGINED","spot_instrument":"BINANCE:SPOT:ETHUSDT"},"protective_stop_distance":"0.02","quote_quantum_usdt":"0.00000001","risk_rehearsal":{"daily_boundary_timezone":"UTC","daily_limit_action":"STOP_NEW_RISK_UNTIL_NEXT_UTC_DAY","daily_loss_limit_usdt":"2","drawdown_limit_action":"FLATTEN_AND_STAGE_FAIL","drawdown_limit_usdt":"5","equality_triggers":true,"gross_drift_action":"REDUCE_BEFORE_STRATEGY_OR_FLATTEN_FAIL","margin_exhausted_action":"FLATTEN_AND_STAGE_FAIL"},"schema_version":"1.0.0","spot_taker_fee":"0.0015","starting_virtual_equity_usdt":"100","status":"CONTRACT_FROZEN_FIXTURE_SIMULATION_NOT_STARTED","technical_leverage_cap":"2","venue":"BINANCE_ONLY","warnings":["FIXTURE_ONLY_NOT_LIVE_MARKET","NO_ACCOUNT_OR_VENUE_FEE_CLAIM","NO_OPERATIONAL_OR_ECONOMIC_TIMER_STARTED","NO_PROFITABILITY_OR_CANARY_ELIGIBILITY"]}